{"agent_release":{"agent_version_id":"00000000-0000-4000-8000-000000000039","agent_version_sha256":"aaaaaaaaaaaaaaaaaaaaaaaaaaaaaaaaaaaaaaaaaaaaaaaaaaaaaaaaaaaaaaaa","evaluation_id":"00000000-0000-4000-8000-000000000236","evaluation_sha256":"aaaaaaaaaaaaaaaaaaaaaaaaaaaaaaaaaaaaaaaaaaaaaaaaaaaaaaaaaaaaaaaa","human_checkpoints":[{"checkpoint_id":"A","decision_schema":{"schema_ref":"https://fixture.invalid/immutable","schema_sha256":"aaaaaaaaaaaaaaaaaaaaaaaaaaaaaaaaaaaaaaaaaaaaaaaaaaaaaaaaaaaaaaaa"},"operation_id":"A","policy_revision":{"content_sha256":"aaaaaaaaaaaaaaaaaaaaaaaaaaaaaaaaaaaaaaaaaaaaaaaaaaaaaaaaaaaaaaaa","version_id":"00000000-0000-4000-8000-000000000073"},"required_action":"A","role_version_ids":["00000000-0000-4000-8000-000000000081"],"trigger_schema":{"schema_ref":"https://fixture.invalid/immutable","schema_sha256":"aaaaaaaaaaaaaaaaaaaaaaaaaaaaaaaaaaaaaaaaaaaaaaaaaaaaaaaaaaaaaaaa"}}],"input_output_schema_refs":[{"consumer_version_id":"00000000-0000-4000-8000-000000000048","direction":"INPUT","schema":{"schema_ref":"https://fixture.invalid/immutable","schema_sha256":"aaaaaaaaaaaaaaaaaaaaaaaaaaaaaaaaaaaaaaaaaaaaaaaaaaaaaaaaaaaaaaaa"}}],"limits":{"activity_start_to_close_seconds":1,"currency":"UTC","heartbeat_interval_seconds":1,"heartbeat_timeout_seconds":1,"max_consecutive_no_progress":"1","max_cost_amount":"1","max_input_tokens":"1","max_model_requests":"1","max_output_tokens":"1","max_parallel_steps":"1","max_repeated_failure_signature":"1","max_research_questions":"1","max_research_rounds":"1","max_revision_rounds":"1","max_tool_calls":"1","max_total_tokens":"1","max_wall_time_seconds":1,"model_request_timeout_seconds":1,"model_spawned_subagents":0,"paid_request_extra_retries":0,"sdk_initialize_timeout_seconds":1,"sdk_request_timeout_seconds":1},"model_config_revisions":[{"content_sha256":"aaaaaaaaaaaaaaaaaaaaaaaaaaaaaaaaaaaaaaaaaaaaaaaaaaaaaaaaaaaaaaaa","version_id":"00000000-0000-4000-8000-000000000298"}],"prompt_revisions":[{"content_sha256":"aaaaaaaaaaaaaaaaaaaaaaaaaaaaaaaaaaaaaaaaaaaaaaaaaaaaaaaaaaaaaaaa","version_id":"00000000-0000-4000-8000-000000000046"}],"release_id":"00000000-0000-4000-8000-000000000007","release_scope":{"allowed_classifications":["A"],"audience_mode":"MEMBERS","member_ids":["00000000-0000-4000-8000-000000000003"],"project_ids":[],"project_mode":"ENTERPRISE","role_ids":[],"source_scope_policy":{"content_sha256":"aaaaaaaaaaaaaaaaaaaaaaaaaaaaaaaaaaaaaaaaaaaaaaaaaaaaaaaaaaaaaaaa","version_id":"00000000-0000-4000-8000-000000000245"},"tenant_id":"00000000-0000-4000-8000-000000000001"},"retrieval_profiles":[{"content_sha256":"aaaaaaaaaaaaaaaaaaaaaaaaaaaaaaaaaaaaaaaaaaaaaaaaaaaaaaaaaaaaaaaa","version_id":"00000000-0000-4000-8000-000000000342"}],"role_versions":[{"content_sha256":"aaaaaaaaaaaaaaaaaaaaaaaaaaaaaaaaaaaaaaaaaaaaaaaaaaaaaaaaaaaaaaaa","version_id":"00000000-0000-4000-8000-000000000042"}],"rule_versions":[{"content_sha256":"aaaaaaaaaaaaaaaaaaaaaaaaaaaaaaaaaaaaaaaaaaaaaaaaaaaaaaaaaaaaaaaa","version_id":"00000000-0000-4000-8000-000000000053"}],"runtime_manifest":{"artifact_schema":{"schema_ref":"https://fixture.invalid/immutable","schema_sha256":"aaaaaaaaaaaaaaaaaaaaaaaaaaaaaaaaaaaaaaaaaaaaaaaaaaaaaaaaaaaaaaaa"},"body_schema":{"schema_ref":"https://fixture.invalid/immutable","schema_sha256":"aaaaaaaaaaaaaaaaaaaaaaaaaaaaaaaaaaaaaaaaaaaaaaaaaaaaaaaaaaaaaaaa"},"event_adapters":[{"component":"C07","implementation":{"artifact_id":"00000000-0000-4000-8000-000000000218","media_type":"a","sha256":"aaaaaaaaaaaaaaaaaaaaaaaaaaaaaaaaaaaaaaaaaaaaaaaaaaaaaaaaaaaaaaaa","size_bytes":"1"},"input_schema":{"schema_ref":"https://fixture.invalid/immutable","schema_sha256":"aaaaaaaaaaaaaaaaaaaaaaaaaaaaaaaaaaaaaaaaaaaaaaaaaaaaaaaaaaaaaaaa"},"output_schema":{"schema_ref":"https://fixture.invalid/immutable","schema_sha256":"aaaaaaaaaaaaaaaaaaaaaaaaaaaaaaaaaaaaaaaaaaaaaaaaaaaaaaaaaaaaaaaa"},"version":{"content_sha256":"aaaaaaaaaaaaaaaaaaaaaaaaaaaaaaaaaaaaaaaaaaaaaaaaaaaaaaaaaaaaaaaa","version_id":"00000000-0000-4000-8000-000000000216"}},{"component":"C07","implementation":{"artifact_id":"00000000-0000-4000-8000-000000000228","media_type":"a","sha256":"aaaaaaaaaaaaaaaaaaaaaaaaaaaaaaaaaaaaaaaaaaaaaaaaaaaaaaaaaaaaaaaa","size_bytes":"1"},"input_schema":{"schema_ref":"https://fixture.invalid/immutable","schema_sha256":"aaaaaaaaaaaaaaaaaaaaaaaaaaaaaaaaaaaaaaaaaaaaaaaaaaaaaaaaaaaaaaaa"},"output_schema":{"schema_ref":"https://fixture.invalid/immutable","schema_sha256":"aaaaaaaaaaaaaaaaaaaaaaaaaaaaaaaaaaaaaaaaaaaaaaaaaaaaaaaaaaaaaaaa"},"version":{"content_sha256":"aaaaaaaaaaaaaaaaaaaaaaaaaaaaaaaaaaaaaaaaaaaaaaaaaaaaaaaaaaaaaaaa","version_id":"00000000-0000-4000-8000-000000000226"}}],"harness_distribution":{"artifact":{"artifact_id":"00000000-0000-4000-8000-000000000087","media_type":"a","sha256":"aaaaaaaaaaaaaaaaaaaaaaaaaaaaaaaaaaaaaaaaaaaaaaaaaaaaaaaaaaaaaaaa","size_bytes":"1"},"name":"A","version":"a"},"model_stream_schema":{"schema_ref":"https://fixture.invalid/immutable","schema_sha256":"aaaaaaaaaaaaaaaaaaaaaaaaaaaaaaaaaaaaaaaaaaaaaaaaaaaaaaaaaaaaaaaa"},"platform":{"architecture":"a","operating_system":"a","python_abi":"a"},"plugins":[{"artifact":{"artifact_id":"00000000-0000-4000-8000-000000000102","media_type":"a","sha256":"aaaaaaaaaaaaaaaaaaaaaaaaaaaaaaaaaaaaaaaaaaaaaaaaaaaaaaaaaaaaaaaa","size_bytes":"1"},"dependency_ids":[],"plugin_id":"A","version":"a"}],"profile":{"artifact":{"artifact_id":"00000000-0000-4000-8000-000000000106","media_type":"a","sha256":"aaaaaaaaaaaaaaaaaaaaaaaaaaaaaaaaaaaaaaaaaaaaaaaaaaaaaaaaaaaaaaaa","size_bytes":"1"},"schema":{"schema_ref":"https://fixture.invalid/immutable","schema_sha256":"aaaaaaaaaaaaaaaaaaaaaaaaaaaaaaaaaaaaaaaaaaaaaaaaaaaaaaaaaaaaaaaa"}},"python_runtime":{"artifact":{"artifact_id":"00000000-0000-4000-8000-000000000093","media_type":"a","sha256":"aaaaaaaaaaaaaaaaaaaaaaaaaaaaaaaaaaaaaaaaaaaaaaaaaaaaaaaaaaaaaaaa","size_bytes":"1"},"name":"A","version":"a"},"sdk_configuration":{"artifact":{"artifact_id":"00000000-0000-4000-8000-000000000112","media_type":"a","sha256":"aaaaaaaaaaaaaaaaaaaaaaaaaaaaaaaaaaaaaaaaaaaaaaaaaaaaaaaaaaaaaaaa","size_bytes":"1"},"schema":{"schema_ref":"https://fixture.invalid/immutable","schema_sha256":"aaaaaaaaaaaaaaaaaaaaaaaaaaaaaaaaaaaaaaaaaaaaaaaaaaaaaaaaaaaaaaaa"}},"session_format":{"schema_ref":"https://fixture.invalid/immutable","schema_sha256":"aaaaaaaaaaaaaaaaaaaaaaaaaaaaaaaaaaaaaaaaaaaaaaaaaaaaaaaaaaaaaaaa"},"source_commit":"aaaaaaaaaaaaaaaaaaaaaaaaaaaaaaaaaaaaaaaaaaaaaaaaaaaaaaaaaaaaaaaa","source_repository":"https://fixture.invalid/immutable","source_version":"a","validators":[{"implementation":{"artifact_id":"00000000-0000-4000-8000-000000000128","media_type":"a","sha256":"aaaaaaaaaaaaaaaaaaaaaaaaaaaaaaaaaaaaaaaaaaaaaaaaaaaaaaaaaaaaaaaa","size_bytes":"1"},"rule_id":"AS-01","version":{"content_sha256":"aaaaaaaaaaaaaaaaaaaaaaaaaaaaaaaaaaaaaaaaaaaaaaaaaaaaaaaaaaaaaaaa","version_id":"00000000-0000-4000-8000-000000000126"}},{"implementation":{"artifact_id":"00000000-0000-4000-8000-000000000134","media_type":"a","sha256":"aaaaaaaaaaaaaaaaaaaaaaaaaaaaaaaaaaaaaaaaaaaaaaaaaaaaaaaaaaaaaaaa","size_bytes":"1"},"rule_id":"AS-01","version":{"content_sha256":"aaaaaaaaaaaaaaaaaaaaaaaaaaaaaaaaaaaaaaaaaaaaaaaaaaaaaaaaaaaaaaaa","version_id":"00000000-0000-4000-8000-000000000132"}},{"implementation":{"artifact_id":"00000000-0000-4000-8000-000000000140","media_type":"a","sha256":"aaaaaaaaaaaaaaaaaaaaaaaaaaaaaaaaaaaaaaaaaaaaaaaaaaaaaaaaaaaaaaaa","size_bytes":"1"},"rule_id":"AS-01","version":{"content_sha256":"aaaaaaaaaaaaaaaaaaaaaaaaaaaaaaaaaaaaaaaaaaaaaaaaaaaaaaaaaaaaaaaa","version_id":"00000000-0000-4000-8000-000000000138"}},{"implementation":{"artifact_id":"00000000-0000-4000-8000-000000000146","media_type":"a","sha256":"aaaaaaaaaaaaaaaaaaaaaaaaaaaaaaaaaaaaaaaaaaaaaaaaaaaaaaaaaaaaaaaa","size_bytes":"1"},"rule_id":"AS-01","version":{"content_sha256":"aaaaaaaaaaaaaaaaaaaaaaaaaaaaaaaaaaaaaaaaaaaaaaaaaaaaaaaaaaaaaaaa","version_id":"00000000-0000-4000-8000-000000000144"}},{"implementation":{"artifact_id":"00000000-0000-4000-8000-000000000152","media_type":"a","sha256":"aaaaaaaaaaaaaaaaaaaaaaaaaaaaaaaaaaaaaaaaaaaaaaaaaaaaaaaaaaaaaaaa","size_bytes":"1"},"rule_id":"AS-01","version":{"content_sha256":"aaaaaaaaaaaaaaaaaaaaaaaaaaaaaaaaaaaaaaaaaaaaaaaaaaaaaaaaaaaaaaaa","version_id":"00000000-0000-4000-8000-000000000150"}},{"implementation":{"artifact_id":"00000000-0000-4000-8000-000000000158","media_type":"a","sha256":"aaaaaaaaaaaaaaaaaaaaaaaaaaaaaaaaaaaaaaaaaaaaaaaaaaaaaaaaaaaaaaaa","size_bytes":"1"},"rule_id":"AS-01","version":{"content_sha256":"aaaaaaaaaaaaaaaaaaaaaaaaaaaaaaaaaaaaaaaaaaaaaaaaaaaaaaaaaaaaaaaa","version_id":"00000000-0000-4000-8000-000000000156"}},{"implementation":{"artifact_id":"00000000-0000-4000-8000-000000000164","media_type":"a","sha256":"aaaaaaaaaaaaaaaaaaaaaaaaaaaaaaaaaaaaaaaaaaaaaaaaaaaaaaaaaaaaaaaa","size_bytes":"1"},"rule_id":"AS-01","version":{"content_sha256":"aaaaaaaaaaaaaaaaaaaaaaaaaaaaaaaaaaaaaaaaaaaaaaaaaaaaaaaaaaaaaaaa","version_id":"00000000-0000-4000-8000-000000000162"}},{"implementation":{"artifact_id":"00000000-0000-4000-8000-000000000170","media_type":"a","sha256":"aaaaaaaaaaaaaaaaaaaaaaaaaaaaaaaaaaaaaaaaaaaaaaaaaaaaaaaaaaaaaaaa","size_bytes":"1"},"rule_id":"AS-01","version":{"content_sha256":"aaaaaaaaaaaaaaaaaaaaaaaaaaaaaaaaaaaaaaaaaaaaaaaaaaaaaaaaaaaaaaaa","version_id":"00000000-0000-4000-8000-000000000168"}},{"implementation":{"artifact_id":"00000000-0000-4000-8000-000000000176","media_type":"a","sha256":"aaaaaaaaaaaaaaaaaaaaaaaaaaaaaaaaaaaaaaaaaaaaaaaaaaaaaaaaaaaaaaaa","size_bytes":"1"},"rule_id":"AS-01","version":{"content_sha256":"aaaaaaaaaaaaaaaaaaaaaaaaaaaaaaaaaaaaaaaaaaaaaaaaaaaaaaaaaaaaaaaa","version_id":"00000000-0000-4000-8000-000000000174"}},{"implementation":{"artifact_id":"00000000-0000-4000-8000-000000000182","media_type":"a","sha256":"aaaaaaaaaaaaaaaaaaaaaaaaaaaaaaaaaaaaaaaaaaaaaaaaaaaaaaaaaaaaaaaa","size_bytes":"1"},"rule_id":"AS-01","version":{"content_sha256":"aaaaaaaaaaaaaaaaaaaaaaaaaaaaaa